{
  "rule_uid": "rule-v4.5-schema-validation-demo",
  "rule_name": "Execution plan schema validation stays valid",
  "scope": "project",
  "target": "Harness v4 minimal runner",
  "source_issue_uid": "issue-v4.5-demo",
  "trigger_condition": "Run when validating the local minimal regression executor path.",
  "expected_result": "The example execution plan validates against execution_plan.schema.json.",
  "verification_action": {
    "schema": "execution_plan",
    "input": "examples/execution_plan.valid.json"
  },
  "executor_type": "schema_validation",
  "severity": "medium",
  "status": "active",
  "owner": "harness-maintainers",
  "created_at": "2026-04-26T00:00:00Z",
  "updated_at": "2026-04-26T00:00:00Z",
  "executor_config": {
    "schema": "execution_plan",
    "input": "examples/execution_plan.valid.json"
  },
  "schema_version": "v4.3.0"
}
